{
  "label": "Günlük challenge",
  "number": 12,
  "words": ["although", "deadline", "manage to"],
  "task": "Bu 3 kelimeyi TEK cümlede kullan 👇",
  "example": "==Although== the ==deadline== was tight, we ==managed to== finish the report.",
  "cta": "Senin cümlen yorumlara! En iyisini paylaşacağım",
  "meta": {
    "topic": "although / deadline / manage to",
    "caption": "Günlük Challenge #12 🔥\n\nBu 3 kelimeyi tek bir cümlede kullan:\n1️⃣ although\n2️⃣ deadline\n3️⃣ manage to\n\nÖrnek: Although the deadline was tight, we managed to finish the report.\n\nSenin cümlen yorumlara 👇 En iyi cümleyi story'de paylaşacağım!\n\nDaily challenge: use all 3 words in one sentence.",
    "hashtags": ["#ingilizcechallenge", "#ingilizce", "#ahkakademi", "#dailychallenge", "#learnenglish", "#ielts", "#ingilizceöğreniyorum", "#vocabulary", "#englishpractice", "#writingpractice", "#toefl"],
    "audio_mood": "game-show countdown beat, buzzer-free, upbeat"
  }
}
